{
  "$schema": "http://json-schema.org/draft-07/schema#",
  "title": "MCP Manifest",
  "type":"object",
  "required":["mcp_version","service","capabilities"],
  "properties":{
    "mcp_version":{"type":"string"},
    "service":{"type":"string"},
    "service_version":{"type":"string"},
    "capabilities":{"type":"array","items":{"type":"object"}}
  }
}
