{
  "mcp_version": "1.0.0",
  "service": "python-example-server",
  "service_version": "1.0.0",
  "capabilities": [
    {"name":"get_time","description":"Get current UTC time","input_schema_ref":"/spec/schemas/empty.json","output_schema_ref":"/spec/schemas/get_time_output.json","auth_required":false,"idempotent":true},
    {"name":"echo","description":"Echo input","input_schema_ref":"/spec/schemas/any.json","output_schema_ref":"/spec/schemas/any.json","auth_required":false,"idempotent":true},
    {"name":"file_search","description":"Search indexed files","input_schema_ref":"/spec/schemas/file_search_input.json","output_schema_ref":"/spec/schemas/file_search_output.json","auth_required":true,"scopes":["file:read"],"rate_limit":{"requests_per_minute":120}}
  ]
}
